<?xml version="1.0" encoding="ISO-8859-1" standalone="yes"?>
<juego xmlns:xsi="http://www.w3.org/2001/XMLSchema-instance" xsi:noNamespaceSchemaLocation="../xsd/juego-logica.xsd">
	<id>20</id>
	<titulo>Casamientos</titulo>
	<texto>5 mujeres se casan con sus respectivos esposos, descubre que material resalta en sus joyas, de que color eligió su vestido y en que ciudad pasarán su luna de miel</texto>
	<costo>353</costo>
	<dimensiones>
		<dimension>
			<id>Nombre</id>
			<valores>
				<valor>Bárbara</valor>
				<valor>Pamela</valor>
				<valor>Victoria</valor>
				<valor>Claudia</valor>
				<valor>Jimena</valor>
			</valores>
		</dimension>
		<dimension>
			<id>Marido</id>
			<valores>
				<valor>Maximiliano</valor>
				<valor>Roberto</valor>
				<valor>Ignacio</valor>
				<valor>Renzo</valor>
				<valor>Osvaldo</valor>
			</valores>
		</dimension>
		<dimension>
			<id>Joya</id>
			<valores>
				<valor>oro</valor>
				<valor>plata</valor>
				<valor>diamante</valor>
				<valor>zafiro</valor>
				<valor>esmeralda</valor>
			</valores>
		</dimension>
		<dimension>
			<id>Vestido</id>
			<valores>
				<valor>blanco</valor>
				<valor>marfil</valor>
				<valor>beige</valor>
				<valor>champagne</valor>
				<valor>crema</valor>
			</valores>
		</dimension>
		<dimension>
			<id>Ciudad</id>
			<valores>
				<valor>Florencia</valor>
				<valor>Venecia</valor>
				<valor>París</valor>
				<valor>New York</valor>
				<valor>Viena</valor>
			</valores>
		</dimension>
	</dimensiones>
	<pistas-del-juego>
		<pista-del-juego>
			<texto>Victoria, quien se vá de luna de miel a Viena, no tiene ni una esmeralda ni un zafiro en su joya</texto>
			<pistas>
				<pista>
					<id-dimension1>Ciudad</id-dimension1>
					<id-valor1>Viena</id-valor1>
					<id-dimension2>Joya</id-dimension2>
					<id-valor2>esmeralda</id-valor2>
					<afirma-niega>false</afirma-niega>
				</pista>
				<pista>
					<id-dimension1>Nombre</id-dimension1>
					<id-valor1>Victoria</id-valor1>
					<id-dimension2>Ciudad</id-dimension2>
					<id-valor2>Viena</id-valor2>
					<afirma-niega>true</afirma-niega>
				</pista>
				<pista>
					<id-dimension1>Ciudad</id-dimension1>
					<id-valor1>Viena</id-valor1>
					<id-dimension2>Joya</id-dimension2>
					<id-valor2>zafiro</id-valor2>
					<afirma-niega>false</afirma-niega>
				</pista>
			</pistas>
		</pista-del-juego>
		<pista-del-juego>
			<texto>Claudia elige New York para su luna de miel y recibe un hermoso anillo de oro puro</texto>
			<pistas>
				<pista>
					<id-dimension1>Ciudad</id-dimension1>
					<id-valor1>New York</id-valor1>
					<id-dimension2>Nombre</id-dimension2>
					<id-valor2>Claudia</id-valor2>
					<afirma-niega>true</afirma-niega>
				</pista>
				<pista>
					<id-dimension1>Nombre</id-dimension1>
					<id-valor1>Claudia</id-valor1>
					<id-dimension2>Joya</id-dimension2>
					<id-valor2>oro</id-valor2>
					<afirma-niega>true</afirma-niega>
				</pista>
			</pistas>
		</pista-del-juego>
		<pista-del-juego>
			<texto>Pamela se niega a usar un vestido color champagne</texto>
			<pistas>
				<pista>
					<id-dimension1>Vestido</id-dimension1>
					<id-valor1>champagne</id-valor1>
					<id-dimension2>Nombre</id-dimension2>
					<id-valor2>Pamela</id-valor2>
					<afirma-niega>false</afirma-niega>
				</pista>
			</pistas>
		</pista-del-juego>
		<pista-del-juego>
			<texto>Bárbara, la del vestido beige, no se casa con Osvaldo</texto>
			<pistas>
				<pista>
					<id-dimension1>Nombre</id-dimension1>
					<id-valor1>Bárbara</id-valor1>
					<id-dimension2>Marido</id-dimension2>
					<id-valor2>Osvaldo</id-valor2>
					<afirma-niega>false</afirma-niega>
				</pista>
				<pista>
					<id-dimension1>Vestido</id-dimension1>
					<id-valor1>beige</id-valor1>
					<id-dimension2>Nombre</id-dimension2>
					<id-valor2>Bárbara</id-valor2>
					<afirma-niega>true</afirma-niega>
				</pista>
			</pistas>
		</pista-del-juego>
		<pista-del-juego>
			<texto>Pamela y su futuro marido Roberto no optaron por pasar su luna de miel en París</texto>
			<pistas>
				<pista>
					<id-dimension1>Nombre</id-dimension1>
					<id-valor1>Pamela</id-valor1>
					<id-dimension2>Marido</id-dimension2>
					<id-valor2>Roberto</id-valor2>
					<afirma-niega>true</afirma-niega>
				</pista>
				<pista>
					<id-dimension1>Nombre</id-dimension1>
					<id-valor1>Pamela</id-valor1>
					<id-dimension2>Ciudad</id-dimension2>
					<id-valor2>París</id-valor2>
					<afirma-niega>false</afirma-niega>
				</pista>
			</pistas>
		</pista-del-juego>
		<pista-del-juego>
			<texto>Jimena sueña con su luna de miel en Venecia, pero no le gusta el color marfil para su vestido, ni las esmeraldas</texto>
			<pistas>
				<pista>
					<id-dimension1>Ciudad</id-dimension1>
					<id-valor1>Venecia</id-valor1>
					<id-dimension2>Joya</id-dimension2>
					<id-valor2>esmeralda</id-valor2>
					<afirma-niega>false</afirma-niega>
				</pista>
				<pista>
					<id-dimension1>Ciudad</id-dimension1>
					<id-valor1>Venecia</id-valor1>
					<id-dimension2>Vestido</id-dimension2>
					<id-valor2>marfil</id-valor2>
					<afirma-niega>false</afirma-niega>
				</pista>
				<pista>
					<id-dimension1>Ciudad</id-dimension1>
					<id-valor1>Venecia</id-valor1>
					<id-dimension2>Nombre</id-dimension2>
					<id-valor2>Jimena</id-valor2>
					<afirma-niega>true</afirma-niega>
				</pista>
			</pistas>
		</pista-del-juego>
		<pista-del-juego>
			<texto>Quien se casará con Renzo usa un vestido crema, pero no tiene la joya hecha en plata</texto>
			<pistas>
				<pista>
					<id-dimension1>Marido</id-dimension1>
					<id-valor1>Renzo</id-valor1>
					<id-dimension2>Joya</id-dimension2>
					<id-valor2>plata</id-valor2>
					<afirma-niega>false</afirma-niega>
				</pista>
				<pista>
					<id-dimension1>Marido</id-dimension1>
					<id-valor1>Renzo</id-valor1>
					<id-dimension2>Vestido</id-dimension2>
					<id-valor2>crema</id-valor2>
					<afirma-niega>true</afirma-niega>
				</pista>
			</pistas>
		</pista-del-juego>
		<pista-del-juego>
			<texto>Quien usa la joya con una piedra de zafiro no usa el vestido de color beige ni marfil y no es Jimena</texto>
			<pistas>
				<pista>
					<id-dimension1>Joya</id-dimension1>
					<id-valor1>zafiro</id-valor1>
					<id-dimension2>Vestido</id-dimension2>
					<id-valor2>beige</id-valor2>
					<afirma-niega>false</afirma-niega>
				</pista>
				<pista>
					<id-dimension1>Joya</id-dimension1>
					<id-valor1>zafiro</id-valor1>
					<id-dimension2>Nombre</id-dimension2>
					<id-valor2>Jimena</id-valor2>
					<afirma-niega>false</afirma-niega>
				</pista>
				<pista>
					<id-dimension1>Joya</id-dimension1>
					<id-valor1>zafiro</id-valor1>
					<id-dimension2>Vestido</id-dimension2>
					<id-valor2>marfil</id-valor2>
					<afirma-niega>false</afirma-niega>
				</pista>
			</pistas>
		</pista-del-juego>
		<pista-del-juego>
			<texto>Jimena quien se casa con Maximiliano no recibirá la joya hecha en plata</texto>
			<pistas>
				<pista>
					<id-dimension1>Marido</id-dimension1>
					<id-valor1>Maximiliano</id-valor1>
					<id-dimension2>Nombre</id-dimension2>
					<id-valor2>Jimena</id-valor2>
					<afirma-niega>true</afirma-niega>
				</pista>
				<pista>
					<id-dimension1>Marido</id-dimension1>
					<id-valor1>Maximiliano</id-valor1>
					<id-dimension2>Joya</id-dimension2>
					<id-valor2>plata</id-valor2>
					<afirma-niega>false</afirma-niega>
				</pista>
			</pistas>
		</pista-del-juego>
	</pistas-del-juego>
</juego>