<?xml version="1.0" encoding="ISO-8859-1"?>
<juego xmlns:xsi="http://www.w3.org/2001/XMLSchema-instance" xsi:noNamespaceSchemaLocation="../xsd/juego-logica.xsd">
	<id>4</id>
	<titulo>Esot\u00E9rico</titulo>
	<texto>A pesar del misterio que rodea a la vidente Virginia, su jornada laboral se puede deducir leyendo cinco apuntes - los de abajo - sacados de su agenda.  Relacione los datos en el gr\u00E1fico y adivine la hora de cita de los clientes, los temas de sus consultas y las herramientas m\u00E1gicas que piensa utilizar</texto>
	<costo>105</costo>
	<dimensiones>
		<dimension>
			<id>Cliente</id>
			<valores>
				<valor>Amalia</valor>
				<valor>Benito</valor>
				<valor>Jos\u00E9</valor>
				<valor>Matilde</valor>
			</valores>
		</dimension>
		<dimension>
			<id>Hora</id>
			<valores>
				<valor>16:00</valor>
				<valor>16:30</valor>
				<valor>17:00</valor>
				<valor>17:30</valor>
			</valores>
		</dimension>
		<dimension>
			<id>Herramienta</id>
			<valores>
				<valor>Bola de cristal</valor>
				<valor>Posos</valor>
				<valor>Tarot</valor>
				<valor>Velas</valor>
			</valores>
		</dimension>
		<dimension>
			<id>Temas</id>
			<valores>
				<valor>Amores</valor>
				<valor>Dinero</valor>
				<valor>Familia</valor>
				<valor>Salud</valor>
			</valores>
		</dimension>
	</dimensiones>
	<pistas-del-juego>
		<pista-del-juego>
			<texto>En la cita concertada con Matilde, indagar\u00E9 sobre sus futuros amores</texto>
			<pistas>
				<pista>
					<id-dimension1>Cliente</id-dimension1>
					<id-valor1>Matilde</id-valor1>
					<id-dimension2>Temas</id-dimension2>
					<id-valor2>Amores</id-valor2>
					<afirma-niega>true</afirma-niega>
				</pista>
			</pistas>
		</pista-del-juego>
		<pista-del-juego>
			<texto>Para la entrevista de las 17:00 horas, me servir\u00E9 de la bola de cristal</texto>
			<pistas>
				<pista>
					<id-dimension1>Hora</id-dimension1>
					<id-valor1>17:00</id-valor1>
					<id-dimension2>Herramienta</id-dimension2>
					<id-valor2>Bola de cristal</id-valor2>
					<afirma-niega>true</afirma-niega>
				</pista>
			</pistas>
		</pista-del-juego>
		<pista-del-juego>
			<texto>El tarot lo utilizar\u00E9 antes de atender a Jos\u00E9 y despu\u00E9s de responder al cliente preocupado por cuestiones de dinero</texto>
			<pistas>
				<pista>
					<id-dimension1>Herramienta</id-dimension1>
					<id-valor1>Tarot</id-valor1>
					<id-dimension2>Cliente</id-dimension2>
					<id-valor2>Jos\u00E9</id-valor2>
					<afirma-niega>false</afirma-niega>
				</pista>
				<pista>
					<id-dimension1>Herramienta</id-dimension1>
					<id-valor1>Tarot</id-valor1>
					<id-dimension2>Temas</id-dimension2>
					<id-valor2>Dinero</id-valor2>
					<afirma-niega>false</afirma-niega>
				</pista>
				<pista>
					<id-dimension1>Cliente</id-dimension1>
					<id-valor1>Jos\u00E9</id-valor1>
					<id-dimension2>Hora</id-dimension2>
					<id-valor2>16:00</id-valor2>
					<afirma-niega>false</afirma-niega>
				</pista>
				<pista>
					<id-dimension1>Cliente</id-dimension1>
					<id-valor1>Jos\u00E9</id-valor1>
					<id-dimension2>Hora</id-dimension2>
					<id-valor2>16:30</id-valor2>
					<afirma-niega>false</afirma-niega>
				</pista>
				<pista>
					<id-dimension1>Cliente</id-dimension1>
					<id-valor1>Jos\u00E9</id-valor1>
					<id-dimension2>Temas</id-dimension2>
					<id-valor2>Dinero</id-valor2>
					<afirma-niega>false</afirma-niega>
				</pista>
				<pista>
					<id-dimension1>Temas</id-dimension1>
					<id-valor1>Dinero</id-valor1>
					<id-dimension2>Hora</id-dimension2>
					<id-valor2>17:00</id-valor2>
					<afirma-niega>false</afirma-niega>
				</pista>
				<pista>
					<id-dimension1>Temas</id-dimension1>
					<id-valor1>Dinero</id-valor1>
					<id-dimension2>Hora</id-dimension2>
					<id-valor2>17:30</id-valor2>
					<afirma-niega>false</afirma-niega>
				</pista>
				<pista>
					<id-dimension1>Herramienta</id-dimension1>
					<id-valor1>Tarot</id-valor1>
					<id-dimension2>Hora</id-dimension2>
					<id-valor2>16:00</id-valor2>
					<afirma-niega>false</afirma-niega>
				</pista>
				<pista>
					<id-dimension1>Herramienta</id-dimension1>
					<id-valor1>Tarot</id-valor1>
					<id-dimension2>Hora</id-dimension2>
					<id-valor2>17:30</id-valor2>
					<afirma-niega>false</afirma-niega>
				</pista>
			</pistas>
		</pista-del-juego>
		<pista-del-juego>
			<texto>Para responder a las preguntas de quien acude por temas de familia, recurrir\u00E9 a las velas</texto>
			<pistas>
				<pista>
					<id-dimension1>Temas</id-dimension1>
					<id-valor1>Familia</id-valor1>
					<id-dimension2>Herramienta</id-dimension2>
					<id-valor2>Velas</id-valor2>
					<afirma-niega>true</afirma-niega>
				</pista>
			</pistas>
		</pista-del-juego>
		<pista-del-juego>
			<texto>Benito viene por motivos de salud. No le atender\u00E9 a las 16:30</texto>
			<pistas>
				<pista>
					<id-dimension1>Cliente</id-dimension1>
					<id-valor1>Benito</id-valor1>
					<id-dimension2>Temas</id-dimension2>
					<id-valor2>Salud</id-valor2>
					<afirma-niega>true</afirma-niega>
				</pista>
				<pista>
					<id-dimension1>Cliente</id-dimension1>
					<id-valor1>Benito</id-valor1>
					<id-dimension2>Hora</id-dimension2>
					<id-valor2>16:30</id-valor2>
					<afirma-niega>false</afirma-niega>
				</pista>
			</pistas>
		</pista-del-juego>
	</pistas-del-juego>
</juego>
