<?xml version="1.0" encoding="ISO-8859-1"?>
<juego xmlns:xsi="http://www.w3.org/2001/XMLSchema-instance" xsi:noNamespaceSchemaLocation="../xsd/juego-logica.xsd">
	<id>3</id>
	<titulo>Vacaciones en las islas</titulo>
	<texto>Descubre a que isla viajar\u00E1 cada una de las 4 amigas, en que compa\u00F1\u00EDa a\u00E9rea y cuantos d\u00EDas durar\u00E1 su estad\u00EDa</texto>
	<costo>156</costo>
	<dimensiones>
		<dimension>
			<id>Nombre</id>
			<valores>
				<valor>Carolina</valor>
				<valor>Diana</valor>
				<valor>Luisa</valor>
				<valor>Mar\u00EDa</valor>
			</valores>
		</dimension>
		<dimension>
			<id>Isla</id>
			<valores>
				<valor>Ibiza</valor>
				<valor>Lanzarote</valor>
				<valor>Mallorca</valor>
				<valor>Tenerife</valor>
			</valores>
		</dimension>
		<dimension>
			<id>Compa\u00F1ia</id>
			<valores>
				<valor>Air France</valor>
				<valor>Iberia</valor>
				<valor>Lufthansa</valor>
				<valor>Sabena</valor>
			</valores>
		</dimension>
		<dimension>
			<id>D\u00EDas</id>
			<valores>
				<valor>7</valor>
				<valor>10</valor>
				<valor>14</valor>
				<valor>15</valor>
			</valores>
		</dimension>
	</dimensiones>
	<pistas-del-juego>
		<pista-del-juego>
			<texto>Diana ha planeado ir a Lanzarote</texto>
			<pistas>
				<pista>
					<id-dimension1>Nombre</id-dimension1>
					<id-valor1>Diana</id-valor1>
					<id-dimension2>Isla</id-dimension2>
					<id-valor2>Lanzarote</id-valor2>
					<afirma-niega>true</afirma-niega>
				</pista>
			</pistas>
		</pista-del-juego>
		<pista-del-juego>
			<texto>La que va a volar con Sabena pasar\u00E1 siete d\u00EDas en su isla elegida</texto>
			<pistas>
				<pista>
					<id-dimension1>Compa\u00F1ia</id-dimension1>
					<id-valor1>Sabena</id-valor1>
					<id-dimension2>D\u00EDas</id-dimension2>
					<id-valor2>7</id-valor2>
					<afirma-niega>true</afirma-niega>
				</pista>
			</pistas>
		</pista-del-juego>
		<pista-del-juego>
			<texto>Lufthansa es la compa\u00F1\u00EDa elegida por la que viajar\u00E1 a Tenerife</texto>
			<pistas>
				<pista>
					<id-dimension1>Compa\u00F1ia</id-dimension1>
					<id-valor1>Lufthansa</id-valor1>
					<id-dimension2>Isla</id-dimension2>
					<id-valor2>Tenerife</id-valor2>
					<afirma-niega>true</afirma-niega>
				</pista>
			</pistas>
		</pista-del-juego>
		<pista-del-juego>
			<texto>Quien volar\u00E1 con Air France cuenta con 15 d\u00EDas de descanso</texto>
			<pistas>
				<pista>
					<id-dimension1>Compa\u00F1ia</id-dimension1>
					<id-valor1>Air France</id-valor1>
					<id-dimension2>D\u00EDas</id-dimension2>
					<id-valor2>15</id-valor2>
					<afirma-niega>true</afirma-niega>
				</pista>
			</pistas>
		</pista-del-juego>
		<pista-del-juego>
			<texto>Carolina se tomar\u00E1 diez d\u00EDas de relax</texto>
			<pistas>
				<pista>
					<id-dimension1>Nombre</id-dimension1>
					<id-valor1>Carolina</id-valor1>
					<id-dimension2>D\u00EDas</id-dimension2>
					<id-valor2>10</id-valor2>
					<afirma-niega>true</afirma-niega>
				</pista>
			</pistas>
		</pista-del-juego>
		<pista-del-juego>
			<texto>Quien viajar\u00E1 con Iberia se ha reservado m\u00E1s d\u00EDas que quien viajar\u00E1 a Mallorca</texto>
			<pistas>
				<pista>
					<id-dimension1>Compa\u00F1ia</id-dimension1>
					<id-valor1>Iberia</id-valor1>
					<id-dimension2>D\u00EDas</id-dimension2>
					<id-valor2>7</id-valor2>
					<afirma-niega>false</afirma-niega>
				</pista>
				<pista>
					<id-dimension1>Isla</id-dimension1>
					<id-valor1>Mallorca</id-valor1>
					<id-dimension2>D\u00EDas</id-dimension2>
					<id-valor2>15</id-valor2>
					<afirma-niega>false</afirma-niega>
				</pista>
			</pistas>
		</pista-del-juego>
		<pista-del-juego>
			<texto>Luisa no piensa ir a Ibiza</texto>
			<pistas>
				<pista>
					<id-dimension1>Nombre</id-dimension1>
					<id-valor1>Luisa</id-valor1>
					<id-dimension2>Isla</id-dimension2>
					<id-valor2>Ibiza</id-valor2>
					<afirma-niega>false</afirma-niega>
				</pista>
			</pistas>
		</pista-del-juego>
		<pista-del-juego>
			<texto>Mar\u00EDa (que no visitar\u00E1 Tenerife) tiene programados 14 d\u00EDas de ocio</texto>
			<pistas>
				<pista>
					<id-dimension1>Nombre</id-dimension1>
					<id-valor1>Mar\u00EDa</id-valor1>
					<id-dimension2>Isla</id-dimension2>
					<id-valor2>Tenerife</id-valor2>
					<afirma-niega>false</afirma-niega>
				</pista>
				<pista>
					<id-dimension1>Nombre</id-dimension1>
					<id-valor1>Mar\u00EDa</id-valor1>
					<id-dimension2>D\u00EDas</id-dimension2>
					<id-valor2>14</id-valor2>
					<afirma-niega>true</afirma-niega>
				</pista>
			</pistas>
		</pista-del-juego>
	</pistas-del-juego>
</juego>
