<?xml version="1.0" encoding="ISO-8859-1" standalone="yes"?>
<juego xmlns:xsi="http://www.w3.org/2001/XMLSchema-instance" xsi:noNamespaceSchemaLocation="../xsd/juego-logica.xsd">
	<id>16</id>
	<titulo>Juegos infantiles</titulo>
	<texto>Descubre cual es el juguete preferido de cada ni\u00F1o, de que color es y donde le gusta jugar</texto>
	<costo>50</costo>
	<dimensiones>
		<dimension>
			<id>Nombre</id>
			<valores>
				<valor>Luis</valor>
				<valor>Mat\u00EDas</valor>
				<valor>Renzo</valor>
			</valores>
		</dimension>
		<dimension>
			<id>Juguete</id>
			<valores>
				<valor>Cami\u00F3n</valor>
				<valor>Pelota</valor>
				<valor>Mu\u00F1eco</valor>
			</valores>
		</dimension>
		<dimension>
			<id>Color</id>
			<valores>
				<valor>Rojo</valor>
				<valor>Verde</valor>
				<valor>Azul</valor>
			</valores>
		</dimension>
		<dimension>
			<id>Lugar</id>
			<valores>
				<valor>Living</valor>
				<valor>Dormitorio</valor>
				<valor>Patio</valor>
			</valores>
		</dimension>
	</dimensiones>
	<pistas-del-juego>
		<pista-del-juego>
			<texto>A Luis le gusta jugar con su pelota</texto>
			<pistas>
				<pista>
					<id-dimension1>Nombre</id-dimension1>
					<id-valor1>Luis</id-valor1>
					<id-dimension2>Juguete</id-dimension2>
					<id-valor2>Pelota</id-valor2>
					<afirma-niega>true</afirma-niega>
				</pista>
			</pistas>
		</pista-del-juego>
		<pista-del-juego>
			<texto>Mat\u00EDas prefiere el juguete de color verde</texto>
			<pistas>
				<pista>
					<id-dimension1>Nombre</id-dimension1>
					<id-valor1>Mat\u00EDas</id-valor1>
					<id-dimension2>Color</id-dimension2>
					<id-valor2>Verde</id-valor2>
					<afirma-niega>true</afirma-niega>
				</pista>
			</pistas>
		</pista-del-juego>
		<pista-del-juego>
			<texto>Quien prefiere el mu\u00F1eco (que es de color rojo), no le gusta jugar en el dormitorio</texto>
			<pistas>
				<pista>
					<id-dimension1>Juguete</id-dimension1>
					<id-valor1>Mu\u00F1eco</id-valor1>
					<id-dimension2>Color</id-dimension2>
					<id-valor2>Rojo</id-valor2>
					<afirma-niega>true</afirma-niega>
				</pista>
				<pista>
					<id-dimension1>Lugar</id-dimension1>
					<id-valor1>Dormitorio</id-valor1>
					<id-dimension2>Juguete</id-dimension2>
					<id-valor2>Mu\u00F1eco</id-valor2>
					<afirma-niega>false</afirma-niega>
				</pista>
			</pistas>
		</pista-del-juego>
		<pista-del-juego>
			<texto>El ni\u00F1o que juega en el patio prefiere hacerlo con su pelota</texto>
			<pistas>
				<pista>
					<id-dimension1>Juguete</id-dimension1>
					<id-valor1>Pelota</id-valor1>
					<id-dimension2>Lugar</id-dimension2>
					<id-valor2>Patio</id-valor2>
					<afirma-niega>true</afirma-niega>
				</pista>
			</pistas>
		</pista-del-juego>
	</pistas-del-juego>
</juego>
